{
  "schema_version": 1,
  "run_id": "trial-protected-20261016-013908-262b21",
  "mode": "protected",
  "status": "completed",
  "events": [
    {
      "timestamp_ms": 0,
      "thread_id": "system",
      "action": "start",
      "owners": {},
      "waits": {},
      "risk_score": 0,
      "wait_duration_ms": 0,
      "contention_count": 0
    },
    {
      "timestamp_ms": 0,
      "thread_id": "T1",
      "action": "acquire",
      "owners": {
        "A": "T1"
      },
      "waits": {},
      "risk_score": 3,
      "wait_duration_ms": 0,
      "contention_count": 0,
      "resource_id": "A"
    },
    {
      "timestamp_ms": 0,
      "thread_id": "T2",
      "action": "acquire",
      "owners": {
        "A": "T1",
        "B": "T2"
      },
      "waits": {},
      "risk_score": 15,
      "wait_duration_ms": 0,
      "contention_count": 0,
      "resource_id": "B"
    },
    {
      "timestamp_ms": 16,
      "thread_id": "T1",
      "action": "wait",
      "owners": {
        "A": "T1",
        "B": "T2"
      },
      "waits": {
        "T1": "B"
      },
      "risk_score": 72,
      "wait_duration_ms": 0,
      "contention_count": 1,
      "resource_id": "B"
    },
    {
      "timestamp_ms": 16,
      "thread_id": "system",
      "action": "warning",
      "owners": {
        "A": "T1",
        "B": "T2"
      },
      "waits": {
        "T1": "B"
      },
      "risk_score": 72,
      "wait_duration_ms": 0,
      "contention_count": 1
    },
    {
      "timestamp_ms": 16,
      "thread_id": "T2",
      "action": "release",
      "owners": {
        "A": "T1"
      },
      "waits": {},
      "risk_score": 7,
      "wait_duration_ms": 0,
      "contention_count": 1,
      "resource_id": "B"
    },
    {
      "timestamp_ms": 16,
      "thread_id": "T1",
      "action": "acquire",
      "owners": {
        "A": "T1",
        "B": "T1"
      },
      "waits": {},
      "risk_score": 10,
      "wait_duration_ms": 0,
      "contention_count": 1,
      "resource_id": "B"
    },
    {
      "timestamp_ms": 16,
      "thread_id": "T1",
      "action": "release",
      "owners": {
        "A": "T1"
      },
      "waits": {},
      "risk_score": 7,
      "wait_duration_ms": 0,
      "contention_count": 1,
      "resource_id": "B"
    },
    {
      "timestamp_ms": 16,
      "thread_id": "T1",
      "action": "release",
      "owners": {},
      "waits": {},
      "risk_score": 4,
      "wait_duration_ms": 0,
      "contention_count": 1,
      "resource_id": "A"
    },
    {
      "timestamp_ms": 16,
      "thread_id": "system",
      "action": "policy_applied",
      "owners": {},
      "waits": {},
      "risk_score": 4,
      "wait_duration_ms": 0,
      "contention_count": 1
    },
    {
      "timestamp_ms": 16,
      "thread_id": "T1",
      "action": "request",
      "owners": {},
      "waits": {},
      "risk_score": 4,
      "wait_duration_ms": 0,
      "contention_count": 1,
      "resource_id": "A"
    },
    {
      "timestamp_ms": 16,
      "thread_id": "T1",
      "action": "acquire",
      "owners": {
        "A": "T1"
      },
      "waits": {},
      "risk_score": 7,
      "wait_duration_ms": 0,
      "contention_count": 1,
      "resource_id": "A"
    },
    {
      "timestamp_ms": 16,
      "thread_id": "T1",
      "action": "request",
      "owners": {
        "A": "T1"
      },
      "waits": {},
      "risk_score": 7,
      "wait_duration_ms": 0,
      "contention_count": 1,
      "resource_id": "B"
    },
    {
      "timestamp_ms": 16,
      "thread_id": "T1",
      "action": "acquire",
      "owners": {
        "A": "T1",
        "B": "T1"
      },
      "waits": {},
      "risk_score": 10,
      "wait_duration_ms": 0,
      "contention_count": 1,
      "resource_id": "B"
    },
    {
      "timestamp_ms": 31,
      "thread_id": "system",
      "action": "policy_applied",
      "owners": {
        "A": "T1",
        "B": "T1"
      },
      "waits": {},
      "risk_score": 10,
      "wait_duration_ms": 0,
      "contention_count": 1
    },
    {
      "timestamp_ms": 31,
      "thread_id": "T2",
      "action": "request",
      "owners": {
        "A": "T1",
        "B": "T1"
      },
      "waits": {},
      "risk_score": 10,
      "wait_duration_ms": 0,
      "contention_count": 1,
      "resource_id": "A"
    },
    {
      "timestamp_ms": 31,
      "thread_id": "T2",
      "action": "wait",
      "owners": {
        "A": "T1",
        "B": "T1"
      },
      "waits": {
        "T2": "A"
      },
      "risk_score": 32,
      "wait_duration_ms": 0,
      "contention_count": 2,
      "resource_id": "A"
    },
    {
      "timestamp_ms": 62,
      "thread_id": "T1",
      "action": "release",
      "owners": {
        "A": "T1"
      },
      "waits": {
        "T2": "A"
      },
      "risk_score": 30,
      "wait_duration_ms": 31,
      "contention_count": 2,
      "resource_id": "B"
    },
    {
      "timestamp_ms": 62,
      "thread_id": "T1",
      "action": "release",
      "owners": {},
      "waits": {},
      "risk_score": 9,
      "wait_duration_ms": 31,
      "contention_count": 2,
      "resource_id": "A"
    },
    {
      "timestamp_ms": 62,
      "thread_id": "T2",
      "action": "acquire",
      "owners": {
        "A": "T2"
      },
      "waits": {},
      "risk_score": 12,
      "wait_duration_ms": 31,
      "contention_count": 2,
      "resource_id": "A"
    },
    {
      "timestamp_ms": 62,
      "thread_id": "T2",
      "action": "request",
      "owners": {
        "A": "T2"
      },
      "waits": {},
      "risk_score": 12,
      "wait_duration_ms": 31,
      "contention_count": 2,
      "resource_id": "B"
    },
    {
      "timestamp_ms": 62,
      "thread_id": "T2",
      "action": "acquire",
      "owners": {
        "A": "T2",
        "B": "T2"
      },
      "waits": {},
      "risk_score": 15,
      "wait_duration_ms": 31,
      "contention_count": 2,
      "resource_id": "B"
    },
    {
      "timestamp_ms": 109,
      "thread_id": "T2",
      "action": "release",
      "owners": {
        "A": "T2"
      },
      "waits": {},
      "risk_score": 12,
      "wait_duration_ms": 31,
      "contention_count": 2,
      "resource_id": "B"
    },
    {
      "timestamp_ms": 109,
      "thread_id": "T2",
      "action": "release",
      "owners": {},
      "waits": {},
      "risk_score": 9,
      "wait_duration_ms": 31,
      "contention_count": 2,
      "resource_id": "A"
    },
    {
      "timestamp_ms": 109,
      "thread_id": "system",
      "action": "complete",
      "owners": {},
      "waits": {},
      "risk_score": 9,
      "wait_duration_ms": 31,
      "contention_count": 2
    }
  ]
}
