{
  "schema_version": 1,
  "run_id": "example-protected-001",
  "mode": "protected",
  "status": "completed",
  "events": [
    { "timestamp_ms": 0, "thread_id": "system", "action": "start", "owners": {}, "waits": {}, "risk_score": 8, "wait_duration_ms": 0, "contention_count": 0 },
    { "timestamp_ms": 200, "thread_id": "system", "action": "policy_applied", "owners": {}, "waits": {}, "risk_score": 14, "wait_duration_ms": 0, "contention_count": 0 },
    { "timestamp_ms": 400, "thread_id": "T1", "action": "acquire", "resource_id": "B", "owners": { "A": "T1", "B": "T1" }, "waits": {}, "risk_score": 18, "wait_duration_ms": 0, "contention_count": 0 },
    { "timestamp_ms": 600, "thread_id": "T2", "action": "wait", "resource_id": "A", "owners": { "A": "T1", "B": "T1" }, "waits": { "T2": "A" }, "risk_score": 39, "wait_duration_ms": 200, "contention_count": 1 },
    { "timestamp_ms": 800, "thread_id": "T1", "action": "release", "resource_id": "A", "owners": {}, "waits": {}, "risk_score": 25, "wait_duration_ms": 400, "contention_count": 1 },
    { "timestamp_ms": 1000, "thread_id": "T2", "action": "acquire", "resource_id": "B", "owners": { "A": "T2", "B": "T2" }, "waits": {}, "risk_score": 16, "wait_duration_ms": 400, "contention_count": 1 },
    { "timestamp_ms": 1200, "thread_id": "system", "action": "complete", "owners": {}, "waits": {}, "risk_score": 6, "wait_duration_ms": 400, "contention_count": 1 }
  ]
}

